{"$id":"https://schemas.cloudmarkup.com/architecture-document/v1.schema.json","$schema":"https://json-schema.org/draft/2020-12/schema","additionalProperties":false,"properties":{"architectureId":{"pattern":"^[A-Za-z0-9][A-Za-z0-9._:-]{0,127}$","type":"string"},"assumptions":{"items":{"additionalProperties":false,"properties":{"id":{"pattern":"^[A-Za-z0-9][A-Za-z0-9._:-]{0,127}$","type":"string"},"origin":{"enum":["user","template","ai-accepted","connection-rule","migration"],"type":"string"},"statement":{"minLength":1,"type":"string"},"status":{"enum":["unverified","accepted","rejected"],"type":"string"}},"required":["id","statement","status","origin"],"type":"object"},"type":"array"},"catalog":{"additionalProperties":false,"properties":{"digest":{"pattern":"^sha256:[a-f0-9]{64}$","type":"string"},"id":{"pattern":"^[a-z][a-z0-9-]*(?:\\.[a-z][a-z0-9-]*)+$","type":"string"},"version":{"pattern":"^(0|[1-9]\\d*)\\.(0|[1-9]\\d*)\\.(0|[1-9]\\d*)(?:-[0-9A-Za-z-]+(?:\\.[0-9A-Za-z-]+)*)?(?:\\+[0-9A-Za-z-]+(?:\\.[0-9A-Za-z-]+)*)?$","type":"string"}},"required":["id","version","digest"],"type":"object"},"compilerCompatibility":{"additionalProperties":false,"properties":{"inputContractVersion":{"const":1,"type":"number"},"maximumCompilerVersionExclusive":{"pattern":"^(0|[1-9]\\d*)\\.(0|[1-9]\\d*)\\.(0|[1-9]\\d*)(?:-[0-9A-Za-z-]+(?:\\.[0-9A-Za-z-]+)*)?(?:\\+[0-9A-Za-z-]+(?:\\.[0-9A-Za-z-]+)*)?$","type":"string"},"minimumCompilerVersion":{"pattern":"^(0|[1-9]\\d*)\\.(0|[1-9]\\d*)\\.(0|[1-9]\\d*)(?:-[0-9A-Za-z-]+(?:\\.[0-9A-Za-z-]+)*)?(?:\\+[0-9A-Za-z-]+(?:\\.[0-9A-Za-z-]+)*)?$","type":"string"}},"required":["inputContractVersion","minimumCompilerVersion"],"type":"object"},"documentId":{"pattern":"^[A-Za-z0-9][A-Za-z0-9._:-]{0,127}$","type":"string"},"edges":{"items":{"additionalProperties":false,"properties":{"id":{"pattern":"^[A-Za-z0-9][A-Za-z0-9._:-]{0,127}$","type":"string"},"semantic":{"additionalProperties":false,"properties":{"configuration":{"additionalProperties":false,"properties":{"schemaId":{"pattern":"^[a-z][a-z0-9-]*(?:\\.[a-z][a-z0-9-]*)+$","type":"string"},"schemaVersion":{"pattern":"^(0|[1-9]\\d*)\\.(0|[1-9]\\d*)\\.(0|[1-9]\\d*)(?:-[0-9A-Za-z-]+(?:\\.[0-9A-Za-z-]+)*)?(?:\\+[0-9A-Za-z-]+(?:\\.[0-9A-Za-z-]+)*)?$","type":"string"},"values":{"additionalProperties":{"oneOf":[{"additionalProperties":false,"properties":{"kind":{"const":"string","type":"string"},"value":{"type":"string"}},"required":["kind","value"],"type":"object"},{"additionalProperties":false,"properties":{"kind":{"const":"number","type":"string"},"value":{"type":"number"}},"required":["kind","value"],"type":"object"},{"additionalProperties":false,"properties":{"kind":{"const":"integer","type":"string"},"value":{"maximum":9007199254740991,"minimum":-9007199254740991,"type":"integer"}},"required":["kind","value"],"type":"object"},{"additionalProperties":false,"properties":{"kind":{"const":"boolean","type":"string"},"value":{"type":"boolean"}},"required":["kind","value"],"type":"object"},{"additionalProperties":false,"properties":{"kind":{"const":"string-list","type":"string"},"value":{"items":{"type":"string"},"type":"array"}},"required":["kind","value"],"type":"object"},{"additionalProperties":false,"properties":{"kind":{"const":"number-list","type":"string"},"value":{"items":{"type":"number"},"type":"array"}},"required":["kind","value"],"type":"object"},{"additionalProperties":false,"properties":{"attribute":{"pattern":"^[a-z][a-z0-9-]*(?:\\.[a-z][a-z0-9-]*)+$","type":"string"},"kind":{"const":"node-reference","type":"string"},"nodeId":{"pattern":"^[A-Za-z0-9][A-Za-z0-9._:-]{0,127}$","type":"string"}},"required":["kind","nodeId","attribute"],"type":"object"},{"additionalProperties":false,"properties":{"kind":{"const":"variable-reference","type":"string"},"variableId":{"pattern":"^[A-Za-z0-9][A-Za-z0-9._:-]{0,127}$","type":"string"}},"required":["kind","variableId"],"type":"object"},{"additionalProperties":false,"properties":{"kind":{"const":"secret-reference","type":"string"},"reference":{"pattern":"^[A-Za-z0-9][A-Za-z0-9._:-]{0,127}$","type":"string"}},"required":["kind","reference"],"type":"object"}]},"propertyNames":{"pattern":"^[a-z][a-zA-Z0-9]*(?:[.-][a-zA-Z0-9]+)*$","type":"string"},"type":"object"}},"required":["schemaId","schemaVersion","values"],"type":"object"},"lifecycle":{"oneOf":[{"additionalProperties":false,"properties":{"origin":{"enum":["user","template","ai-accepted","migration"],"type":"string"},"ownership":{"const":"user","type":"string"}},"required":["ownership","origin"],"type":"object"},{"additionalProperties":false,"properties":{"origin":{"enum":["template","connection-rule","migration"],"type":"string"},"ownership":{"const":"generated","type":"string"},"provenance":{"additionalProperties":false,"properties":{"dependentEdgeIds":{"items":{"pattern":"^[A-Za-z0-9][A-Za-z0-9._:-]{0,127}$","type":"string"},"type":"array"},"dependentNodeIds":{"items":{"pattern":"^[A-Za-z0-9][A-Za-z0-9._:-]{0,127}$","type":"string"},"type":"array"},"generatorId":{"pattern":"^[a-z][a-z0-9-]*(?:\\.[a-z][a-z0-9-]*)+$","type":"string"},"generatorKind":{"enum":["template-expansion","connection-rule","migration"],"type":"string"},"generatorVersion":{"pattern":"^(0|[1-9]\\d*)\\.(0|[1-9]\\d*)\\.(0|[1-9]\\d*)(?:-[0-9A-Za-z-]+(?:\\.[0-9A-Za-z-]+)*)?(?:\\+[0-9A-Za-z-]+(?:\\.[0-9A-Za-z-]+)*)?$","type":"string"},"operationId":{"pattern":"^[A-Za-z0-9][A-Za-z0-9._:-]{0,127}$","type":"string"}},"required":["generatorKind","generatorId","generatorVersion","operationId","dependentNodeIds","dependentEdgeIds"],"type":"object"}},"required":["ownership","origin","provenance"],"type":"object"},{"additionalProperties":false,"properties":{"adoptedAt":{"pattern":"^\\d{4}-(0[1-9]|1[0-2])-(0[1-9]|[12]\\d|3[01])T([01]\\d|2[0-3]):[0-5]\\d:[0-5]\\d(?:\\.\\d+)?Z$","type":"string"},"adoptedBy":{"pattern":"^[A-Za-z0-9][A-Za-z0-9._:-]{0,127}$","type":"string"},"origin":{"enum":["template","connection-rule","migration"],"type":"string"},"ownership":{"const":"adopted","type":"string"},"provenance":{"additionalProperties":false,"properties":{"dependentEdgeIds":{"items":{"pattern":"^[A-Za-z0-9][A-Za-z0-9._:-]{0,127}$","type":"string"},"type":"array"},"dependentNodeIds":{"items":{"pattern":"^[A-Za-z0-9][A-Za-z0-9._:-]{0,127}$","type":"string"},"type":"array"},"generatorId":{"pattern":"^[a-z][a-z0-9-]*(?:\\.[a-z][a-z0-9-]*)+$","type":"string"},"generatorKind":{"enum":["template-expansion","connection-rule","migration"],"type":"string"},"generatorVersion":{"pattern":"^(0|[1-9]\\d*)\\.(0|[1-9]\\d*)\\.(0|[1-9]\\d*)(?:-[0-9A-Za-z-]+(?:\\.[0-9A-Za-z-]+)*)?(?:\\+[0-9A-Za-z-]+(?:\\.[0-9A-Za-z-]+)*)?$","type":"string"},"operationId":{"pattern":"^[A-Za-z0-9][A-Za-z0-9._:-]{0,127}$","type":"string"}},"required":["generatorKind","generatorId","generatorVersion","operationId","dependentNodeIds","dependentEdgeIds"],"type":"object"}},"required":["ownership","origin","provenance","adoptedBy","adoptedAt"],"type":"object"}]},"relationshipType":{"pattern":"^[a-z][a-z0-9-]*(?:\\.[a-z][a-z0-9-]*)+$","type":"string"},"source":{"additionalProperties":false,"properties":{"nodeId":{"pattern":"^[A-Za-z0-9][A-Za-z0-9._:-]{0,127}$","type":"string"},"port":{"pattern":"^[a-z][a-z0-9-]*(?:\\.[a-z][a-z0-9-]*)+$","type":"string"}},"required":["nodeId","port"],"type":"object"},"target":{"additionalProperties":false,"properties":{"nodeId":{"pattern":"^[A-Za-z0-9][A-Za-z0-9._:-]{0,127}$","type":"string"},"port":{"pattern":"^[a-z][a-z0-9-]*(?:\\.[a-z][a-z0-9-]*)+$","type":"string"}},"required":["nodeId","port"],"type":"object"}},"required":["source","target","relationshipType","configuration","lifecycle"],"type":"object"}},"required":["id","semantic"],"type":"object"},"type":"array"},"kind":{"const":"cloudmarkup.architecture-document","type":"string"},"metadata":{"additionalProperties":false,"properties":{"serialization":{"additionalProperties":false,"properties":{"canonicalization":{"const":"cloudmarkup.canonical-json.v1","type":"string"},"encoding":{"const":"utf-8","type":"string"},"mediaType":{"const":"application/json","type":"string"}},"required":["mediaType","encoding","canonicalization"],"type":"object"},"source":{"enum":["user","template","ai-accepted","migration"],"type":"string"}},"required":["source","serialization"],"type":"object"},"nodes":{"items":{"additionalProperties":false,"properties":{"id":{"pattern":"^[A-Za-z0-9][A-Za-z0-9._:-]{0,127}$","type":"string"},"presentation":{"additionalProperties":false,"properties":{"label":{"minLength":1,"type":"string"},"position":{"additionalProperties":false,"properties":{"x":{"type":"number"},"y":{"type":"number"}},"required":["x","y"],"type":"object"}},"required":["label","position"],"type":"object"},"semantic":{"additionalProperties":false,"properties":{"configuration":{"additionalProperties":false,"properties":{"schemaId":{"pattern":"^[a-z][a-z0-9-]*(?:\\.[a-z][a-z0-9-]*)+$","type":"string"},"schemaVersion":{"pattern":"^(0|[1-9]\\d*)\\.(0|[1-9]\\d*)\\.(0|[1-9]\\d*)(?:-[0-9A-Za-z-]+(?:\\.[0-9A-Za-z-]+)*)?(?:\\+[0-9A-Za-z-]+(?:\\.[0-9A-Za-z-]+)*)?$","type":"string"},"values":{"additionalProperties":{"oneOf":[{"additionalProperties":false,"properties":{"kind":{"const":"string","type":"string"},"value":{"type":"string"}},"required":["kind","value"],"type":"object"},{"additionalProperties":false,"properties":{"kind":{"const":"number","type":"string"},"value":{"type":"number"}},"required":["kind","value"],"type":"object"},{"additionalProperties":false,"properties":{"kind":{"const":"integer","type":"string"},"value":{"maximum":9007199254740991,"minimum":-9007199254740991,"type":"integer"}},"required":["kind","value"],"type":"object"},{"additionalProperties":false,"properties":{"kind":{"const":"boolean","type":"string"},"value":{"type":"boolean"}},"required":["kind","value"],"type":"object"},{"additionalProperties":false,"properties":{"kind":{"const":"string-list","type":"string"},"value":{"items":{"type":"string"},"type":"array"}},"required":["kind","value"],"type":"object"},{"additionalProperties":false,"properties":{"kind":{"const":"number-list","type":"string"},"value":{"items":{"type":"number"},"type":"array"}},"required":["kind","value"],"type":"object"},{"additionalProperties":false,"properties":{"attribute":{"pattern":"^[a-z][a-z0-9-]*(?:\\.[a-z][a-z0-9-]*)+$","type":"string"},"kind":{"const":"node-reference","type":"string"},"nodeId":{"pattern":"^[A-Za-z0-9][A-Za-z0-9._:-]{0,127}$","type":"string"}},"required":["kind","nodeId","attribute"],"type":"object"},{"additionalProperties":false,"properties":{"kind":{"const":"variable-reference","type":"string"},"variableId":{"pattern":"^[A-Za-z0-9][A-Za-z0-9._:-]{0,127}$","type":"string"}},"required":["kind","variableId"],"type":"object"},{"additionalProperties":false,"properties":{"kind":{"const":"secret-reference","type":"string"},"reference":{"pattern":"^[A-Za-z0-9][A-Za-z0-9._:-]{0,127}$","type":"string"}},"required":["kind","reference"],"type":"object"}]},"propertyNames":{"pattern":"^[a-z][a-zA-Z0-9]*(?:[.-][a-zA-Z0-9]+)*$","type":"string"},"type":"object"}},"required":["schemaId","schemaVersion","values"],"type":"object"},"deploymentKey":{"pattern":"^[a-z][a-z0-9_]{0,62}$","type":"string"},"lifecycle":{"oneOf":[{"additionalProperties":false,"properties":{"origin":{"enum":["user","template","ai-accepted","migration"],"type":"string"},"ownership":{"const":"user","type":"string"}},"required":["ownership","origin"],"type":"object"},{"additionalProperties":false,"properties":{"origin":{"enum":["template","connection-rule","migration"],"type":"string"},"ownership":{"const":"generated","type":"string"},"provenance":{"additionalProperties":false,"properties":{"dependentEdgeIds":{"items":{"pattern":"^[A-Za-z0-9][A-Za-z0-9._:-]{0,127}$","type":"string"},"type":"array"},"dependentNodeIds":{"items":{"pattern":"^[A-Za-z0-9][A-Za-z0-9._:-]{0,127}$","type":"string"},"type":"array"},"generatorId":{"pattern":"^[a-z][a-z0-9-]*(?:\\.[a-z][a-z0-9-]*)+$","type":"string"},"generatorKind":{"enum":["template-expansion","connection-rule","migration"],"type":"string"},"generatorVersion":{"pattern":"^(0|[1-9]\\d*)\\.(0|[1-9]\\d*)\\.(0|[1-9]\\d*)(?:-[0-9A-Za-z-]+(?:\\.[0-9A-Za-z-]+)*)?(?:\\+[0-9A-Za-z-]+(?:\\.[0-9A-Za-z-]+)*)?$","type":"string"},"operationId":{"pattern":"^[A-Za-z0-9][A-Za-z0-9._:-]{0,127}$","type":"string"}},"required":["generatorKind","generatorId","generatorVersion","operationId","dependentNodeIds","dependentEdgeIds"],"type":"object"}},"required":["ownership","origin","provenance"],"type":"object"},{"additionalProperties":false,"properties":{"adoptedAt":{"pattern":"^\\d{4}-(0[1-9]|1[0-2])-(0[1-9]|[12]\\d|3[01])T([01]\\d|2[0-3]):[0-5]\\d:[0-5]\\d(?:\\.\\d+)?Z$","type":"string"},"adoptedBy":{"pattern":"^[A-Za-z0-9][A-Za-z0-9._:-]{0,127}$","type":"string"},"origin":{"enum":["template","connection-rule","migration"],"type":"string"},"ownership":{"const":"adopted","type":"string"},"provenance":{"additionalProperties":false,"properties":{"dependentEdgeIds":{"items":{"pattern":"^[A-Za-z0-9][A-Za-z0-9._:-]{0,127}$","type":"string"},"type":"array"},"dependentNodeIds":{"items":{"pattern":"^[A-Za-z0-9][A-Za-z0-9._:-]{0,127}$","type":"string"},"type":"array"},"generatorId":{"pattern":"^[a-z][a-z0-9-]*(?:\\.[a-z][a-z0-9-]*)+$","type":"string"},"generatorKind":{"enum":["template-expansion","connection-rule","migration"],"type":"string"},"generatorVersion":{"pattern":"^(0|[1-9]\\d*)\\.(0|[1-9]\\d*)\\.(0|[1-9]\\d*)(?:-[0-9A-Za-z-]+(?:\\.[0-9A-Za-z-]+)*)?(?:\\+[0-9A-Za-z-]+(?:\\.[0-9A-Za-z-]+)*)?$","type":"string"},"operationId":{"pattern":"^[A-Za-z0-9][A-Za-z0-9._:-]{0,127}$","type":"string"}},"required":["generatorKind","generatorId","generatorVersion","operationId","dependentNodeIds","dependentEdgeIds"],"type":"object"}},"required":["ownership","origin","provenance","adoptedBy","adoptedAt"],"type":"object"}]},"parent":{"additionalProperties":false,"properties":{"nodeId":{"pattern":"^[A-Za-z0-9][A-Za-z0-9._:-]{0,127}$","type":"string"},"relationshipType":{"pattern":"^[a-z][a-z0-9-]*(?:\\.[a-z][a-z0-9-]*)+$","type":"string"}},"required":["nodeId","relationshipType"],"type":"object"},"resourceType":{"pattern":"^[a-z][a-z0-9-]*(?:\\.[a-z][a-z0-9-]*)+$","type":"string"},"serviceType":{"pattern":"^[a-z][a-z0-9-]*(?:\\.[a-z][a-z0-9-]*)+$","type":"string"}},"required":["deploymentKey","serviceType","resourceType","configuration","lifecycle"],"type":"object"}},"required":["id","semantic","presentation"],"type":"object"},"type":"array"},"outputs":{"items":{"additionalProperties":false,"properties":{"description":{"minLength":1,"type":"string"},"id":{"pattern":"^[A-Za-z0-9][A-Za-z0-9._:-]{0,127}$","type":"string"},"key":{"pattern":"^[a-z][a-z0-9_]{0,62}$","type":"string"},"sensitive":{"type":"boolean"},"source":{"oneOf":[{"additionalProperties":false,"properties":{"attribute":{"pattern":"^[a-z][a-z0-9-]*(?:\\.[a-z][a-z0-9-]*)+$","type":"string"},"kind":{"const":"node-attribute","type":"string"},"nodeId":{"pattern":"^[A-Za-z0-9][A-Za-z0-9._:-]{0,127}$","type":"string"}},"required":["kind","nodeId","attribute"],"type":"object"},{"additionalProperties":false,"properties":{"kind":{"const":"variable","type":"string"},"variableId":{"pattern":"^[A-Za-z0-9][A-Za-z0-9._:-]{0,127}$","type":"string"}},"required":["kind","variableId"],"type":"object"}]},"valueType":{"enum":["string","number","integer","boolean","string-list","number-list"],"type":"string"}},"required":["id","key","valueType","sensitive","source"],"type":"object"},"type":"array"},"provider":{"additionalProperties":false,"properties":{"id":{"pattern":"^[a-z][a-z0-9-]*(?:\\.[a-z][a-z0-9-]*)+$","type":"string"},"region":{"pattern":"^[a-z][a-z0-9-]{0,62}$","type":"string"}},"required":["id","region"],"type":"object"},"revision":{"additionalProperties":false,"properties":{"createdAt":{"pattern":"^\\d{4}-(0[1-9]|1[0-2])-(0[1-9]|[12]\\d|3[01])T([01]\\d|2[0-3]):[0-5]\\d:[0-5]\\d(?:\\.\\d+)?Z$","type":"string"},"createdBy":{"pattern":"^[A-Za-z0-9][A-Za-z0-9._:-]{0,127}$","type":"string"},"previousRevisionId":{"pattern":"^[A-Za-z0-9][A-Za-z0-9._:-]{0,127}$","type":"string"},"revisionId":{"pattern":"^[A-Za-z0-9][A-Za-z0-9._:-]{0,127}$","type":"string"},"revisionNumber":{"exclusiveMinimum":0,"maximum":9007199254740991,"type":"integer"},"sourceDraftId":{"pattern":"^[A-Za-z0-9][A-Za-z0-9._:-]{0,127}$","type":"string"}},"required":["revisionId","revisionNumber","createdAt","createdBy"],"type":"object"},"schemaVersion":{"const":1,"type":"number"},"unresolvedRequirements":{"items":{"additionalProperties":false,"properties":{"blocking":{"type":"boolean"},"category":{"enum":["functional","availability","security","data","cost","compliance","operational","other"],"type":"string"},"id":{"pattern":"^[A-Za-z0-9][A-Za-z0-9._:-]{0,127}$","type":"string"},"origin":{"enum":["user","template","ai-accepted","connection-rule","migration"],"type":"string"},"statement":{"minLength":1,"type":"string"}},"required":["id","statement","category","blocking","origin"],"type":"object"},"type":"array"},"variables":{"items":{"additionalProperties":false,"properties":{"defaultValue":{"oneOf":[{"additionalProperties":false,"properties":{"kind":{"const":"string","type":"string"},"value":{"type":"string"}},"required":["kind","value"],"type":"object"},{"additionalProperties":false,"properties":{"kind":{"const":"number","type":"string"},"value":{"type":"number"}},"required":["kind","value"],"type":"object"},{"additionalProperties":false,"properties":{"kind":{"const":"integer","type":"string"},"value":{"maximum":9007199254740991,"minimum":-9007199254740991,"type":"integer"}},"required":["kind","value"],"type":"object"},{"additionalProperties":false,"properties":{"kind":{"const":"boolean","type":"string"},"value":{"type":"boolean"}},"required":["kind","value"],"type":"object"},{"additionalProperties":false,"properties":{"kind":{"const":"string-list","type":"string"},"value":{"items":{"type":"string"},"type":"array"}},"required":["kind","value"],"type":"object"},{"additionalProperties":false,"properties":{"kind":{"const":"number-list","type":"string"},"value":{"items":{"type":"number"},"type":"array"}},"required":["kind","value"],"type":"object"},{"additionalProperties":false,"properties":{"attribute":{"pattern":"^[a-z][a-z0-9-]*(?:\\.[a-z][a-z0-9-]*)+$","type":"string"},"kind":{"const":"node-reference","type":"string"},"nodeId":{"pattern":"^[A-Za-z0-9][A-Za-z0-9._:-]{0,127}$","type":"string"}},"required":["kind","nodeId","attribute"],"type":"object"},{"additionalProperties":false,"properties":{"kind":{"const":"variable-reference","type":"string"},"variableId":{"pattern":"^[A-Za-z0-9][A-Za-z0-9._:-]{0,127}$","type":"string"}},"required":["kind","variableId"],"type":"object"},{"additionalProperties":false,"properties":{"kind":{"const":"secret-reference","type":"string"},"reference":{"pattern":"^[A-Za-z0-9][A-Za-z0-9._:-]{0,127}$","type":"string"}},"required":["kind","reference"],"type":"object"}]},"description":{"minLength":1,"type":"string"},"id":{"pattern":"^[A-Za-z0-9][A-Za-z0-9._:-]{0,127}$","type":"string"},"key":{"pattern":"^[a-z][a-z0-9_]{0,62}$","type":"string"},"required":{"type":"boolean"},"valueType":{"enum":["string","number","integer","boolean","string-list","number-list"],"type":"string"}},"required":["id","key","valueType","required"],"type":"object"},"type":"array"}},"required":["kind","schemaVersion","documentId","architectureId","revision","provider","catalog","compilerCompatibility","metadata","nodes","edges","variables","outputs","assumptions","unresolvedRequirements"],"title":"Cloud Markup Architecture Document v1","type":"object"}
